2025-11-24 14:43:39 | INFO | Logging initialized. Log file: /Users/odin/Documents/MLE/translation/outputs/training_20251124_144339.log
2025-11-24 14:43:39 | INFO | ======================================================================
2025-11-24 14:43:39 | INFO | Training Configuration
2025-11-24 14:43:39 | INFO | ======================================================================
2025-11-24 14:43:39 | INFO | Device: mps
2025-11-24 14:43:39 | INFO | Vocabulary Size: 10000
2025-11-24 14:43:39 | INFO | Embedding Dim: 128
2025-11-24 14:43:39 | INFO | Hidden Dim: 256
2025-11-24 14:43:39 | INFO | Num Layers: 1
2025-11-24 14:43:39 | INFO | Dropout: 0.2
2025-11-24 14:43:39 | INFO | Batch Size: 128
2025-11-24 14:43:39 | INFO | Learning Rate: 0.001
2025-11-24 14:43:39 | INFO | Num Epochs: 15
2025-11-24 14:43:39 | INFO | Beam Width: 5
2025-11-24 14:43:39 | INFO | ======================================================================
2025-11-24 14:43:39 | INFO | Initializing tokenizer and loading data...
2025-11-24 14:43:41 | INFO | Source vocabulary size: 10000
2025-11-24 14:43:41 | INFO | Target vocabulary size: 10000
2025-11-24 14:43:41 | INFO | Initializing model...
2025-11-24 14:43:41 | INFO | Model has 17,506,576 trainable parameters
2025-11-24 14:43:42 | INFO | ======================================================================
2025-11-24 14:43:42 | INFO | Starting training...
2025-11-24 14:43:42 | INFO | ======================================================================
2025-11-24 14:43:42 | INFO | Epoch 1/15 - Training...
2025-11-24 14:48:48 | INFO | Epoch 1/15 - Evaluating...
2025-11-24 14:49:04 | INFO | Epoch: 01/15 | Time: 5m 22s
2025-11-24 14:49:04 | INFO | Train Loss: 3.9957 | Val Loss: 3.3351
2025-11-24 14:49:04 | INFO | New best model! Val Loss: 3.3351
2025-11-24 14:49:05 | INFO | Checkpoint saved to /Users/odin/Documents/MLE/translation/models/best_model.pt
2025-11-24 14:49:05 | INFO | Saving periodic checkpoint at epoch 1
2025-11-24 14:49:05 | INFO | Checkpoint saved to /Users/odin/Documents/MLE/translation/models/checkpoint_epoch_1.pt
2025-11-24 14:49:05 | INFO | Epoch 2/15 - Training...
2025-11-24 14:54:25 | INFO | Epoch 2/15 - Evaluating...
2025-11-24 14:54:42 | INFO | Epoch: 02/15 | Time: 5m 37s
2025-11-24 14:54:42 | INFO | Train Loss: 2.3474 | Val Loss: 2.6261
2025-11-24 14:54:42 | INFO | New best model! Val Loss: 2.6261
2025-11-24 14:54:43 | INFO | Checkpoint saved to /Users/odin/Documents/MLE/translation/models/best_model.pt
2025-11-24 14:54:43 | INFO | Saving periodic checkpoint at epoch 2
2025-11-24 14:54:43 | INFO | Checkpoint saved to /Users/odin/Documents/MLE/translation/models/checkpoint_epoch_2.pt
2025-11-24 14:54:43 | INFO | Epoch 3/15 - Training...
2025-11-24 15:00:08 | INFO | Epoch 3/15 - Evaluating...
2025-11-24 15:00:25 | INFO | Epoch: 03/15 | Time: 5m 42s
2025-11-24 15:00:25 | INFO | Train Loss: 1.7560 | Val Loss: 2.3873
2025-11-24 15:00:25 | INFO | New best model! Val Loss: 2.3873
2025-11-24 15:00:26 | INFO | Checkpoint saved to /Users/odin/Documents/MLE/translation/models/best_model.pt
2025-11-24 15:00:26 | INFO | Saving periodic checkpoint at epoch 3
2025-11-24 15:00:26 | INFO | Checkpoint saved to /Users/odin/Documents/MLE/translation/models/checkpoint_epoch_3.pt
2025-11-24 15:00:26 | INFO | Epoch 4/15 - Training...
2025-11-24 15:05:59 | INFO | Epoch 4/15 - Evaluating...
2025-11-24 15:06:18 | INFO | Epoch: 04/15 | Time: 5m 52s
2025-11-24 15:06:18 | INFO | Train Loss: 1.4673 | Val Loss: 2.3049
2025-11-24 15:06:18 | INFO | New best model! Val Loss: 2.3049
2025-11-24 15:06:19 | INFO | Checkpoint saved to /Users/odin/Documents/MLE/translation/models/best_model.pt
2025-11-24 15:06:19 | INFO | Saving periodic checkpoint at epoch 4
2025-11-24 15:06:19 | INFO | Checkpoint saved to /Users/odin/Documents/MLE/translation/models/checkpoint_epoch_4.pt
2025-11-24 15:06:19 | INFO | Epoch 5/15 - Training...
2025-11-24 15:11:47 | INFO | Epoch 5/15 - Evaluating...
2025-11-24 15:12:05 | INFO | Epoch: 05/15 | Time: 5m 45s
2025-11-24 15:12:05 | INFO | Train Loss: 1.2762 | Val Loss: 2.2812
2025-11-24 15:12:05 | INFO | New best model! Val Loss: 2.2812
2025-11-24 15:12:05 | INFO | Checkpoint saved to /Users/odin/Documents/MLE/translation/models/best_model.pt
2025-11-24 15:12:05 | INFO | Saving periodic checkpoint at epoch 5
2025-11-24 15:12:06 | INFO | Checkpoint saved to /Users/odin/Documents/MLE/translation/models/checkpoint_epoch_5.pt
2025-11-24 15:12:06 | INFO | Epoch 6/15 - Training...
2025-11-24 15:17:36 | INFO | Epoch 6/15 - Evaluating...
2025-11-24 15:17:54 | INFO | Epoch: 06/15 | Time: 5m 48s
2025-11-24 15:17:54 | INFO | Train Loss: 1.1400 | Val Loss: 2.2640
2025-11-24 15:17:54 | INFO | New best model! Val Loss: 2.2640
2025-11-24 15:17:54 | INFO | Checkpoint saved to /Users/odin/Documents/MLE/translation/models/best_model.pt
2025-11-24 15:17:54 | INFO | Saving periodic checkpoint at epoch 6
2025-11-24 15:17:55 | INFO | Checkpoint saved to /Users/odin/Documents/MLE/translation/models/checkpoint_epoch_6.pt
2025-11-24 15:17:55 | INFO | Epoch 7/15 - Training...
2025-11-24 15:23:19 | INFO | Epoch 7/15 - Evaluating...
2025-11-24 15:23:37 | INFO | Epoch: 07/15 | Time: 5m 41s
2025-11-24 15:23:37 | INFO | Train Loss: 1.0375 | Val Loss: 2.2815
2025-11-24 15:23:37 | INFO | No improvement. Patience: 1/5
2025-11-24 15:23:37 | INFO | Saving periodic checkpoint at epoch 7
2025-11-24 15:23:37 | INFO | Checkpoint saved to /Users/odin/Documents/MLE/translation/models/checkpoint_epoch_7.pt
2025-11-24 15:23:37 | INFO | Epoch 8/15 - Training...
2025-11-24 15:29:09 | INFO | Epoch 8/15 - Evaluating...
2025-11-24 15:29:26 | INFO | Epoch: 08/15 | Time: 5m 49s
2025-11-24 15:29:26 | INFO | Train Loss: 0.9521 | Val Loss: 2.3125
2025-11-24 15:29:26 | INFO | No improvement. Patience: 2/5
2025-11-24 15:29:26 | INFO | Saving periodic checkpoint at epoch 8
2025-11-24 15:29:27 | INFO | Checkpoint saved to /Users/odin/Documents/MLE/translation/models/checkpoint_epoch_8.pt
2025-11-24 15:29:27 | INFO | Epoch 9/15 - Training...
2025-11-24 15:34:53 | INFO | Epoch 9/15 - Evaluating...
2025-11-24 15:35:11 | INFO | Epoch: 09/15 | Time: 5m 44s
2025-11-24 15:35:11 | INFO | Train Loss: 0.8909 | Val Loss: 2.3380
2025-11-24 15:35:11 | INFO | No improvement. Patience: 3/5
2025-11-24 15:35:11 | INFO | Saving periodic checkpoint at epoch 9
2025-11-24 15:35:12 | INFO | Checkpoint saved to /Users/odin/Documents/MLE/translation/models/checkpoint_epoch_9.pt
2025-11-24 15:35:12 | INFO | Epoch 10/15 - Training...
2025-11-24 15:40:40 | INFO | Epoch 10/15 - Evaluating...
2025-11-24 15:40:58 | INFO | Epoch: 10/15 | Time: 5m 46s
2025-11-24 15:40:58 | INFO | Train Loss: 0.8380 | Val Loss: 2.3511
2025-11-24 15:40:58 | INFO | No improvement. Patience: 4/5
2025-11-24 15:40:58 | INFO | Saving periodic checkpoint at epoch 10
2025-11-24 15:40:59 | INFO | Checkpoint saved to /Users/odin/Documents/MLE/translation/models/checkpoint_epoch_10.pt
2025-11-24 15:40:59 | INFO | Epoch 11/15 - Training...
2025-11-24 15:46:29 | INFO | Epoch 11/15 - Evaluating...
2025-11-24 15:46:50 | INFO | Epoch: 11/15 | Time: 5m 51s
2025-11-24 15:46:50 | INFO | Train Loss: 0.7943 | Val Loss: 2.3846
2025-11-24 15:46:50 | INFO | No improvement. Patience: 5/5
2025-11-24 15:46:50 | INFO | Saving periodic checkpoint at epoch 11
2025-11-24 15:46:51 | INFO | Checkpoint saved to /Users/odin/Documents/MLE/translation/models/checkpoint_epoch_11.pt
2025-11-24 15:46:51 | WARNING | Early stopping triggered after 11 epochs
2025-11-24 15:46:51 | INFO | Saving final model...
2025-11-24 15:46:51 | INFO | Checkpoint saved to /Users/odin/Documents/MLE/translation/models/final_model.pt
2025-11-24 15:46:51 | INFO | Saving tokenizer...
2025-11-24 15:46:51 | INFO | Generating loss plots...
2025-11-24 15:46:53 | INFO | Loss plot saved to /Users/odin/Documents/MLE/translation/outputs/training_loss.png
2025-11-24 15:46:53 | INFO | ======================================================================
2025-11-24 15:46:53 | INFO | Training completed!
2025-11-24 15:46:53 | INFO | Best validation loss: 2.2640
2025-11-24 15:46:53 | INFO | Total epochs: 11
2025-11-24 15:46:53 | INFO | Final train loss: 0.7943
2025-11-24 15:46:53 | INFO | Final val loss: 2.3846
2025-11-24 15:46:53 | INFO | ======================================================================
